command,class,tags,syntax,help
SpawnInvasionFleet,data.console.commands.SpawnInvasionFleet,"campaign,exerelin",spawninvasionfleet,"Spawns an invasion fleet from the closest player-aligned market to go to the closest not-player-aligned market, and teleports fleet to player location."
SpawnInvasionFleetHostile,data.console.commands.SpawnInvasionFleetHostile,"campaign,exerelin",spawninvasionfleethostile,"Spawns an invasion fleet from the closest not-player-aligned market to go to the closest player-aligned market, and teleports fleet to player location."
FlipClosestMarket,data.console.commands.FlipClosestMarket,"campaign,exerelin",flipclosestmarket,Causes the closest market to be captured by a random faction.
#PingDistance,data.console.commands.PingDistance,"campaign,exerelin",pingdistance,Prints distance to closest market.
ClearAgentDestabilization,data.console.commands.ClearAgentDestabilization,"campaign,exerelin",clearagentdestabilization,Removes all agent destabilization events across the sector.
#ResetClosestMarket,data.console.commands.ResetClosestMarket,"campaign,exerelin",resetclosestmarket,Debug command
