name,id,planetary,decivRemove,script,desc,icon,order
#Templar Control,exerelin_templar_control,,,exerelin.campaign.econ.TemplarControl,The Templars exert all-pervasive control over every aspect of the markets they hold. Increases stability and removes stability penalty from smuggling. Creates some demand for marines to enforce order.,graphics/templars/icons/intel/tem_crusade_event.png,31
Rebellion,nex_rebellion_condition,,TRUE,exerelin.campaign.econ.RebellionCondition,"A rebellion is ongoing on $market.

- Stability reduced by $stabilityPenalty
- Increased demand for marines, hand weapons and supplies; sales to $market will strengthen rebels or government depending on channel",graphics/icons/markets/pirate_moot.png,1002
Raiding,nex_raid_condition,,TRUE,exerelin.campaign.econ.RaidCondition,"Hostile raiding fleets are active in the system, disrupting commerce and other activities.",graphics/icons/markets/pirate_activity.png,1301
